<?xml version="1.0" encoding="UTF-8"?>
<list xmlns:xsi="http://www.w3.org/2001/XMLSchema-instance" xsi:noNamespaceSchemaLocation="../xsd/route.xsd">
	<route alias="trajan107" move_type="MoveSuperPoint_FollowRail" isRunning="true">
		<node id="0" x="184428" y="-180868" z="-3744" />
		<node id="1" x="184245" y="-179317" z="-3576" />
		<node id="2" x="186461" y="-179367" z="-3584" />
		<node id="3" x="186108" y="-181465" z="-3384" />
		<node id="4" x="187079" y="-183187" z="-3264" />
		<node id="5" x="185656" y="-184182" z="-3312" />
		<node id="6" x="184011" y="-184102" z="-3296" />
		<node id="7" x="182014" y="-185198" z="-3504" />
		<node id="8" x="179751" y="-185034" z="-3504" />
		<node id="9" x="177624" y="-185039" z="-3800" />
		<node id="10" x="175039" y="-185405" z="-3792" />
	</route>
</list>