<?xml version="1.0" encoding="UTF-8"?>
<list xmlns:xsi="http://www.w3.org/2001/XMLSchema-instance" xsi:noNamespaceSchemaLocation="../xsd/route.xsd">
	<route alias="IceQueen_2F_Right" move_type="MoveSuperPoint_FollowRail">
		<node id="0" x="116353" y="-115466" z="-10984" />
		<node id="1" x="116253" y="-115624" z="-10984" />
		<node id="2" x="115433" y="-116448" z="-10984" />
		<node id="3" x="115371" y="-116515" z="-11032" />
		<node id="4" x="115349" y="-116534" z="-11040" />
		<node id="5" x="115299" y="-116576" z="-11064" />
		<node id="6" x="114715" y="-116762" z="-11080" />
		<node id="7" x="114722" y="-116648" z="-11080" />
		<node id="8" x="114724" y="-116347" z="-11200" />
		<node id="9" x="114805" y="-114936" z="-11200" />
	</route>
</list>