<?xml version="1.0" encoding="UTF-8"?>
<list xmlns:xsi="http://www.w3.org/2001/XMLSchema-instance" xsi:noNamespaceSchemaLocation="../xsd/route.xsd">
	<route alias="lost_76" move_type="MoveSuperPoint_Random">
		<node id="0" x="21340" y="-11092" z="-2784" />
		<node id="1" x="21661" y="-11549" z="-2744" />
		<node id="2" x="22158" y="-10939" z="-2760" />
		<node id="3" x="21791" y="-10137" z="-2808" />
		<node id="4" x="21029" y="-9777" z="-2848" />
		<node id="5" x="20628" y="-10780" z="-2824" />
		<node id="6" x="20961" y="-11761" z="-2776" />
	</route>
</list>