<?xml version="1.0" encoding="UTF-8"?>
<list xmlns:xsi="http://www.w3.org/2001/XMLSchema-instance" xsi:noNamespaceSchemaLocation="../xsd/route.xsd">
	<route alias="anta07" move_type="MoveSuperPoint_FollowRail" isRunning="true" cycling="true">
		<node id="0" x="147470" y="112233" z="-3720" />
		<node id="1" x="148062" y="112676" z="-3720" />
		<node id="2" x="148825" y="112787" z="-3720" />
		<node id="3" x="149111" y="114411" z="-3720" />
		<node id="4" x="149144" y="115414" z="-3720" />
		<node id="5" x="147399" y="116543" z="-3696" />
		<node id="6" x="146176" y="116041" z="-3720" />
		<node id="7" x="144933" y="115060" z="-3720" />
		<node id="8" x="145177" y="113945" z="-3720" />
		<node id="9" x="145195" y="113291" z="-3720" />
		<node id="10" x="146235" y="112582" z="-3720" />
		<node id="11" x="147183" y="112277" z="-3720" />
	</route>
</list>